{
  "version": 1,
  "id": "R-20260805-001",
  "command": "auto",
  "provider": "claude-code",
  "status": "finished",
  "exit_reason": "completed",
  "cycles": [
    {
      "seq": 1,
      "phase": "구현 루프",
      "task_ids": ["T-0001"],
      "started_at": "2026-08-05T10:00:00+09:00",
      "ended_at": "2026-08-05T11:30:00+09:00",
      "report": {
        "summary": "RM-001 메모 목록 화면 구현 완료, 단위 테스트 3건 통과",
        "goals": "1차 로드맵 P0 항목 5건 중 4건 남음. 다음은 저장 기능",
        "next": {
          "task_id": "T-0003",
          "description": "RM-002 메모 저장 기능 구현"
        },
        "progress_pct": 15
      }
    },
    {
      "seq": 2,
      "phase": "독립 검증",
      "task_ids": ["T-0002"],
      "started_at": "2026-08-05T11:30:00+09:00",
      "ended_at": "2026-08-05T12:00:00+09:00",
      "report": {
        "summary": "RM-001 독립 검증 통과 → VERIFIED",
        "goals": "P0 항목 4건 구현·검증 후 최종 게이트",
        "next": {
          "task_id": "T-0003",
          "description": "RM-002 메모 저장 기능 구현"
        },
        "progress_pct": 20
      }
    }
  ],
  "pending_decisions": [
    {
      "subject": "${PLACEHOLDER_PRIVACY_POLICY_URL}",
      "summary": "개인정보처리방침 URL 미확정 — 릴리스 차단 Placeholder, 개발 진행에는 영향 없음",
      "blocking_critical_path": false
    }
  ],
  "started_at": "2026-08-05T10:00:00+09:00",
  "ended_at": "2026-08-05T18:00:00+09:00"
}
